{
  "metadata": {
    "document_path": "uploads\\sample_nda.pdf",
    "analysis_date": "2026-01-06T12:38:05.088372",
    "criteria": [
      "Party identification and contact details",
      "Clear definition of confidential information",
      "Purpose limitation for disclosed information",
      "Obligations of confidentiality and restrictions on use",
      "Permitted disclosure exceptions (e.g. legal, regulatory)",
      "Return or destruction of confidential materials clause",
      "Term/duration of confidentiality obligation",
      "Intellectual property rights and ownership provisions",
      "Liability limitations and remedies for breach",
      "Governing law and jurisdiction clause"
    ],
    "total_criteria_count": 10,
    "analysis_version": "3.0-hidden-risk-detection"
  },
  "summary": "The overall risk level of this agreement is MODERATE RISK (54%). The main concerns are the unlimited liability clause, overly broad definition of Confidential Information, and jurisdiction risks. It is recommended to negotiate the inclusion of explicit clauses for liability cap, data protection, IP ownership, termination, and return/destruction of information.",
  "hidden_risks_detected": [
    {
      "name": "Unlimited Liability",
      "primary_clause": "Clause 10",
      "clause_number": "10",
      "real_meaning": "The Receiving Party may face significant financial risks without any cap on liability.",
      "severity": "CRITICAL"
    },
    {
      "name": "Overly Broad Definition",
      "primary_clause": "Clause 1",
      "clause_number": "1",
      "real_meaning": "The Receiving Party may be obligated to protect non-confidential information as confidential.",
      "severity": "HIGH"
    },
    {
      "name": "Jurisdiction Risk",
      "primary_clause": "Clause 12",
      "clause_number": "12",
      "real_meaning": "The Receiving Party may face jurisdictional risks and potential biases in the Indian courts.",
      "severity": "CRITICAL"
    },
    {
      "name": "Disclosure Permissions",
      "primary_clause": "Clause 4",
      "clause_number": "4",
      "real_meaning": "The Receiving Party may face risks of unauthorized disclosure of Confidential Information.",
      "severity": "MEDIUM"
    }
  ],
  "detection_methodology": {
    "regex_matches": 4,
    "llm_confirmed": 4,
    "false_positives_filtered": 0,
    "definition_traps_found": 1,
    "cross_reference_clusters": 0
  },
  "jurisdiction_intelligence": {
    "vendor_name": "[Unknown]",
    "vendor_location": "India",
    "vendor_classification": "indian_domestic",
    "governing_law": "laws of India",
    "jurisdiction": "competent courts at [__] India",
    "compliance_level_required": "STRICT"
  },
  "indian_law_compliance": {
    "compliant_items": [
      "Clause 10: Obligations of the Receiving Party",
      "Clause 11: Post-termination obligations",
      "Clause 12: Governing law and jurisdiction clause"
    ],
    "violations": [
      "Clause 1: Overly broad definition of Confidential Information (HIGH)",
      "Clause 10: Unlimited liability clause (CRITICAL)"
    ],
    "risks": [
      "Clause 4: Disclosure to employees on a need-to-know basis with written consent from the Disclosing Party (MEDIUM)"
    ]
  },
  "company_policy_compliance": {
    "blocking_violations": [
      "None"
    ],
    "missing_protections": [
      "Liability cap clause (HIGH)",
      "Data protection and privacy clause (HIGH)",
      "IP ownership clarity clause (HIGH)",
      "Termination clause (HIGH)",
      "Return/destruction of information clause (MEDIUM)"
    ],
    "preference_gaps": [
      "NDA duration clause (LOW)",
      "Confidentiality period post-termination clause (LOW)"
    ]
  },
  "protections_found": [
    {
      "name": "Protection 1 (detailed parsing failed - see report)",
      "clause": null,
      "evidence": null
    },
    {
      "name": "Protection 2 (detailed parsing failed - see report)",
      "clause": null,
      "evidence": null
    },
    {
      "name": "Protection 3 (detailed parsing failed - see report)",
      "clause": null,
      "evidence": null
    },
    {
      "name": "Protection 4 (detailed parsing failed - see report)",
      "clause": null,
      "evidence": null
    },
    {
      "name": "Protection 5 (detailed parsing failed - see report)",
      "clause": null,
      "evidence": null
    },
    {
      "name": "Protection 6 (detailed parsing failed - see report)",
      "clause": null,
      "evidence": null
    },
    {
      "name": "Protection 7 (detailed parsing failed - see report)",
      "clause": null,
      "evidence": null
    },
    {
      "name": "Protection 8 (detailed parsing failed - see report)",
      "clause": null,
      "evidence": null
    }
  ],
  "protections_missing": [
    {
      "name": "Liability cap clause",
      "risk": null
    },
    {
      "name": "Data protection and privacy clause",
      "risk": null
    }
  ],
  "counter_proposals": [
    {
      "name": "Liability Cap Clause",
      "priority": "BLOCKING",
      "current_issue": "Unlimited liability clause exposes the Receiving Party to significant financial risks without any cap on liability.",
      "suggested_clause": "In no event shall either party be liable for any consequential, indirect, special, punitive, or incidental damages arising out of or related to this Agreement, even if such party has been advised of the possibility of such damages. The total liability of each party under this Agreement shall not exceed the amount of fees paid or payable by the Disclosing Party to the Receiving Party under this Agreement.",
      "benefit": "Limits the liability exposure of the Receiving Party and provides a reasonable cap on damages."
    },
    {
      "name": "Data Protection & Privacy Clause",
      "priority": "HIGH",
      "current_issue": "No explicit data protection or privacy clause is present in the agreement, exposing the parties to potential data protection law violations.",
      "suggested_clause": "Each party shall comply with all applicable data protection laws and regulations, including but not limited to the Information Technology Act, 2000 and the Digital Personal Data Protection Act, 2023, in connection with any personal data processed under this Agreement. The Receiving Party shall implement and maintain appropriate technical and organizational measures to protect such personal data against unauthorized or unlawful processing and against accidental loss, destruction, damage, alteration, or disclosure. Both parties agree to notify each other within 24 hours of any data breach or suspected breach.",
      "benefit": "Ensures compliance with Indian data protection laws and limits liability exposure."
    },
    {
      "name": "IP Ownership Clarity Clause",
      "priority": "HIGH",
      "current_issue": "No explicit IP ownership clause is present in the agreement, potentially leading to disputes over intellectual property rights.",
      "suggested_clause": "All intellectual property rights in and to the Confidential Information shall remain the property of the Disclosing Party. The Receiving Party shall not acquire any rights, title, or interest in or to the Confidential Information, except as expressly granted in this Agreement.",
      "benefit": "Clarifies the ownership of intellectual property rights and prevents potential disputes."
    },
    {
      "name": "Termination Clause",
      "priority": "HIGH",
      "current_issue": "No explicit termination clause is present in the agreement, although Clause 11 mentions post-termination obligations.",
      "suggested_clause": "Either party may terminate this Agreement upon written notice to the other party. Upon termination, the Receiving Party shall return to the Disclosing Party all Confidential Information and destroy any copies thereof.",
      "benefit": "Provides a clear termination mechanism and ensures the return of Confidential Information."
    },
    {
      "name": "Return/Destruction of Information Clause",
      "priority": "MEDIUM",
      "current_issue": "No explicit return or destruction of information clause is present in the agreement.",
      "suggested_clause": "Upon the request of the Disclosing Party or upon the termination of this Agreement, the Receiving Party shall return to the Disclosing Party all Confidential Information and destroy any copies thereof. The Receiving Party shall provide written confirmation of such destruction to the Disclosing Party.",
      "benefit": "Ensures the return and destruction of Confidential Information and provides written confirmation."
    },
    {
      "name": "NDA Duration Clause",
      "priority": "LOW",
      "current_issue": "No explicit NDA duration is specified in the agreement.",
      "suggested_clause": "The obligations of the Receiving Party under this Agreement shall remain in effect for a period of [__] years from the date of execution.",
      "benefit": "Provides a clear duration for the NDA obligations."
    },
    {
      "name": "Confidentiality Period Post-Termination Clause",
      "priority": "LOW",
      "current_issue": "The post-termination confidentiality period is not explicitly specified in the agreement.",
      "suggested_clause": "The Receiving Party shall maintain the confidentiality of the Confidential Information for a period of [__] years after the termination of this Agreement.",
      "benefit": "Provides a clear post-termination confidentiality period."
    },
    {
      "name": "Jurisdiction Clause",
      "priority": "MEDIUM",
      "current_issue": "The jurisdiction clause is partially specified, but the exact location is not mentioned.",
      "suggested_clause": "The competent courts at [__] India shall have the sole and exclusive jurisdiction over any dispute that arises in relation to this Agreement.",
      "benefit": "Clarifies the jurisdiction clause and specifies the exact location of the competent courts."
    }
  ],
  "risk_assessment": {
    "risk_percentage": 54,
    "risk_level": "MODERATE RISK"
  },
  "recommendation": "NEGOTIATE FIRST The agreement requires significant revisions to address the unlimited liability clause, overly broad definition of Confidential Information, and jurisdiction risks. It is recommended to negotiate the inclusion of explicit clauses for liability cap, data protection, IP ownership, termination, and return/destruction of information.",
  "validation": {
    "is_valid": true,
    "message": "âœ“ JSON data is valid according to schema"
  },
  "_raw_output": "=== LEGAL DOCUMENT RISK ASSESSMENT REPORT ===\n\nEXECUTIVE SUMMARY:\nThe overall risk level of this agreement is MODERATE RISK (54%). The main concerns are the unlimited liability clause, overly broad definition of Confidential Information, and jurisdiction risks. It is recommended to negotiate the inclusion of explicit clauses for liability cap, data protection, IP ownership, termination, and return/destruction of information.\n\n HIDDEN & DISGUISED RISKS:\nDetection Summary:\n- Total Hidden Risks Found: 4\n- Regex Matches: 2 (LLM Confirmed: 2, False Positives: 0)\n- Definitional Traps: 1\n- Cross-Reference Traps: 0\n- Combined Risk Multipliers: None\n\n HIDDEN TRAP #1: Unlimited Liability\nPrimary Clause: Clause 10\nHidden Mechanism: Unlimited liability clause\nHow It Works: The Receiving Party may be liable for unlimited damages without limitation.\nReal Meaning: The Receiving Party may face significant financial risks without any cap on liability.\nSeverity: CRITICAL\nDetection Method: Regex\nConfidence: 0.9\n\n HIDDEN TRAP #2: Overly Broad Definition\nPrimary Clause: Clause 1\nHidden Mechanism: Overly broad definition of Confidential Information\nHow It Works: The definition of Confidential Information is too broad, potentially capturing non-confidential information.\nReal Meaning: The Receiving Party may be obligated to protect non-confidential information as confidential.\nSeverity: HIGH\nDetection Method: Definition Analysis\nConfidence: 0.8\n\n HIDDEN TRAP #3: Jurisdiction Risk\nPrimary Clause: Clause 12\nHidden Mechanism: Exclusive jurisdiction clause\nHow It Works: The competent courts at [__] India have sole and exclusive jurisdiction over any dispute.\nReal Meaning: The Receiving Party may face jurisdictional risks and potential biases in the Indian courts.\nSeverity: CRITICAL\nDetection Method: Regex\nConfidence: 0.9\n\n HIDDEN TRAP #4: Disclosure Permissions\nPrimary Clause: Clause 4\nHidden Mechanism: Disclosure to employees on a need-to-know basis with written consent from the Disclosing Party\nHow It Works: The Receiving Party may disclose Confidential Information to employees without proper authorization.\nReal Meaning: The Receiving Party may face risks of unauthorized disclosure of Confidential Information.\nSeverity: MEDIUM\nDetection Method: Definition Analysis\nConfidence: 0.7\n\nVENDOR & JURISDICTION INTELLIGENCE:\nVendor Name: [Unknown]\nVendor Location: India\nVendor Classification: indian_domestic\nGoverning Law: laws of India\nJurisdiction: competent courts at [__] India\nCompliance Level Required: STRICT\nJurisdiction Risks: HIGH (due to unknown vendor identity and exclusive jurisdiction clause)\n\nINDIAN CONTRACT ACT COMPLIANCE:\n Compliant Items:\n- Clause 10: Obligations of the Receiving Party\n- Clause 11: Post-termination obligations\n- Clause 12: Governing law and jurisdiction clause\n\n Violations Found:\n- Clause 1: Overly broad definition of Confidential Information (HIGH)\n- Clause 10: Unlimited liability clause (CRITICAL)\n\n Risks Identified:\n- Clause 4: Disclosure to employees on a need-to-know basis with written consent from the Disclosing Party (MEDIUM)\n\n10XDS COMPANY POLICY COMPLIANCE:\n Blocking Violations:\n- None\n\n Missing Mandatory Protections:\n- Liability cap clause (HIGH)\n- Data protection and privacy clause (HIGH)\n- IP ownership clarity clause (HIGH)\n- Termination clause (HIGH)\n- Return/destruction of information clause (MEDIUM)\n\n Preference Gaps:\n- NDA duration clause (LOW)\n- Confidentiality period post-termination clause (LOW)\n\nUNIVERSAL NDA CRITERIA ASSESSMENT:\nProtections Found: 8 out of 10\nProtections Missing: 2 out of 10\n1. Liability cap clause\n2. Data protection and privacy clause\n\nOVERALL RISK ASSESSMENT:\nRisk Score: 54 points\nRisk Percentage: 54%\nRisk Level: MODERATE RISK\n\nCategory Breakdown:\n- Hidden Risks: 15 points\n- Indian Law Compliance: 15 points\n- Company Policy Compliance: 12 points\n- Universal Criteria: 12 points\n- Jurisdiction Risks: 10 points\n\nRECOMMENDATION:\nNEGOTIATE FIRST\nThe agreement requires significant revisions to address the unlimited liability clause, overly broad definition of Confidential Information, and jurisdiction risks. It is recommended to negotiate the inclusion of explicit clauses for liability cap, data protection, IP ownership, termination, and return/destruction of information.\n\nRECOMMENDED COUNTER-PROPOSALS:\n---PROPOSAL START---\nName: Liability Cap Clause\nPriority: BLOCKING\nIssue: Unlimited liability clause exposes the Receiving Party to significant financial risks without any cap on liability.\nClause: In no event shall either party be liable for any consequential, indirect, special, punitive, or incidental damages arising out of or related to this Agreement, even if such party has been advised of the possibility of such damages. The total liability of each party under this Agreement shall not exceed the amount of fees paid or payable by the Disclosing Party to the Receiving Party under this Agreement.\nBenefit: Limits the liability exposure of the Receiving Party and provides a reasonable cap on damages.\n---PROPOSAL END---\n\n---PROPOSAL START---\nName: Data Protection & Privacy Clause\nPriority: HIGH\nIssue: No explicit data protection or privacy clause is present in the agreement, exposing the parties to potential data protection law violations.\nClause: Each party shall comply with all applicable data protection laws and regulations, including but not limited to the Information Technology Act, 2000 and the Digital Personal Data Protection Act, 2023, in connection with any personal data processed under this Agreement. The Receiving Party shall implement and maintain appropriate technical and organizational measures to protect such personal data against unauthorized or unlawful processing and against accidental loss, destruction, damage, alteration, or disclosure. Both parties agree to notify each other within 24 hours of any data breach or suspected breach.\nBenefit: Ensures compliance with Indian data protection laws and limits liability exposure.\n---PROPOSAL END---\n\n---PROPOSAL START---\nName: IP Ownership Clarity Clause\nPriority: HIGH\nIssue: No explicit IP ownership clause is present in the agreement, potentially leading to disputes over intellectual property rights.\nClause: All intellectual property rights in and to the Confidential Information shall remain the property of the Disclosing Party. The Receiving Party shall not acquire any rights, title, or interest in or to the Confidential Information, except as expressly granted in this Agreement.\nBenefit: Clarifies the ownership of intellectual property rights and prevents potential disputes.\n---PROPOSAL END---\n\n---PROPOSAL START---\nName: Termination Clause\nPriority: HIGH\nIssue: No explicit termination clause is present in the agreement, although Clause 11 mentions post-termination obligations.\nClause: Either party may terminate this Agreement upon written notice to the other party. Upon termination, the Receiving Party shall return to the Disclosing Party all Confidential Information and destroy any copies thereof.\nBenefit: Provides a clear termination mechanism and ensures the return of Confidential Information.\n---PROPOSAL END---\n\n---PROPOSAL START---\nName: Return/Destruction of Information Clause\nPriority: MEDIUM\nIssue: No explicit return or destruction of information clause is present in the agreement.\nClause: Upon the request of the Disclosing Party or upon the termination of this Agreement, the Receiving Party shall return to the Disclosing Party all Confidential Information and destroy any copies thereof. The Receiving Party shall provide written confirmation of such destruction to the Disclosing Party.\nBenefit: Ensures the return and destruction of Confidential Information and provides written confirmation.\n---PROPOSAL END---\n\n---PROPOSAL START---\nName: NDA Duration Clause\nPriority: LOW\nIssue: No explicit NDA duration is specified in the agreement.\nClause: The obligations of the Receiving Party under this Agreement shall remain in effect for a period of [__] years from the date of execution.\nBenefit: Provides a clear duration for the NDA obligations.\n---PROPOSAL END---\n\n---PROPOSAL START---\nName: Confidentiality Period Post-Termination Clause\nPriority: LOW\nIssue: The post-termination confidentiality period is not explicitly specified in the agreement.\nClause: The Receiving Party shall maintain the confidentiality of the Confidential Information for a period of [__] years after the termination of this Agreement.\nBenefit: Provides a clear post-termination confidentiality period.\n---PROPOSAL END---\n\n---PROPOSAL START---\nName: Jurisdiction Clause\nPriority: MEDIUM\nIssue: The jurisdiction clause is partially specified, but the exact location is not mentioned.\nClause: The competent courts at [__] India shall have the sole and exclusive jurisdiction over any dispute that arises in relation to this Agreement.\nBenefit: Clarifies the jurisdiction clause and specifies the exact location of the competent courts.\n---PROPOSAL END---"
}